Audio,Guión,Audio del locutor,concordacia
ZARZA_Audio_7a_ok,"Es momento de examinar los conocimientos previos que tienes sobre SAP Three-Way Match. Lee cuidadosamente la pregunta y selecciona la opción correcta. Haz clic en el botón Retroalimentación para comprobar tu respuesta. Luego, haz clic en Continuar para cambiar de pregunta.",es momento de examinar los conocimientos previos que tiene sobre SAT Freeway my lee cuidadosamente la pregunta y selecciona la opción correcta Haz clic en el botón retroalimentación para comprobar tu respuesta luego Haz clic en continuar para cambiar de pregunta,98
ZARZA_Audio_8a_ok,Una de las recomendaciones que hemos propuesto es que se marque masivamente este campo en el Registro maestro del proveedor y en el Registro info. Nota: Las actualizaciones masivas solo pueden ser realizadas por el equipo de Soporte de SAP MM.,una de las recomendaciones que hemos propuesto es que es embarque masivamente este campo en el registro maestro del proveedor y en el registro info nota las actualizaciones masivas solo pueden ser realizadas por el equipo de soporte de SAP mm,99
ZARZA_Audio_18_ok,"Ya explicamos cómo identificar Registros de facturas (MIRO) sin referencia a entrada de material que desvirtúan el Three-Way Match cómo se hacen las consultas por SAP; aun así, la prueba de auditoría se debe realizar utilizando el reporte “Direct Postings VERSIÓN 8” que se diseñó en BO para identificar las contabilizaciones directas de una forma más eficiente.",ya explicamos Cómo identificar registros de facturas miró sin referencia a entrada de material que desvirtúan el Tri way match Cómo se hacen las consultas por SAT aún así la prueba de auditoría se debe realizar utilizando el reporte Direct posting versión 8 que diseñó envío para identificar las contabilizaciones directas de una forma más eficiente,97
ZARZA_MODULO 2_Audio_21_ok,"Ahora, por SAP – Tabla CDPOS vamos a explicar a cómo identificar las inclusiones de posiciones en la orden de compra.",ahora por SAP tabla se Depot vamos a explicar a Cómo identificar las inclusiones deposiciones en la orden de compra,96
ZARZA_MODULO 4_Audio_2_ok,"SAP tiene dos formas de registrar los costos indirectos, estas son:",tiene 2 formas de registrar Los costos indirectos estas son,94
ZARZA_MODULO 4_Audio_11_ok,"Ahora ingresamos a SAP, usamos la transacción ME23N para consultar lo siguiente",estos ajustes los podemos identificar por la tabla kbz historial para documento,41
ZARZA_MODULO 4_Audio_17_ok,Compras costes indirectos de adquisición” (Campo: Tipo de historial = “K Actualización de cuentas”).,compras costes indirectos de adquisición campo tipo de historial = K actualización de cuentas,99
ZARZA_MODULO 5_Audio_4_ok,"Es importante aclarar que la verificación del importe de la factura, SAP lo hace con el importe indicado en el Pedido y si excede el % de Tolerancia establecido en la sociedad genera un mensaje de error. Aunque, en algunos mandantes, se tiene configurado que se permita contabilizar como bloqueado el documento que supera la tolerancia, hasta que sea autorizado o rechazado por el responsable de Finanzas local.",es importante aclarar que la verificación del importe de la factura SAP lo hace con el importe indicado en el pedido y si excede el porcentaje de tolerancia establecido en la sociedad genera un mensaje de error Aunque en algunos mandantes se tiene configurado que se permita contabilizar como bloqueado el documento que supera la tolerancia hasta que sea autorizado o rechazado por el representante de finanzas local,97
